preco,condominio,endereço,area,quartos,vagas,banheiros
R$ 570 /mês,R$ 217,"Rua dos Caquizeiros, Cosmos",40 m²,2,1,1
R$ 11.000 /mês,R$ 767,"Centro, Rio de Janeiro",70 m²,0,0,1
R$ 25.000 /mês,R$ 6.044,"Avenida Presidente Wilson, Centro",555 m²,0,0,0
R$ 1.500 /mês,R$ 200,"Irajá, Rio de Janeiro",64 m²,2,0,2
R$ 2.000 /mês,R$ 730,"Rua Conde de Bonfim, Tijuca",110 m²,2,1,2
R$ 1.700 /mês,R$ 400,"Rua Guilherme Marconi, Centro",56 m²,2,0,1
R$ 1.400 /mês,R$ 450,"Estrada dos Bandeirantes, Jacarepaguá",60 m²,2,1,2
R$ 1.300 /mês,0,"Rua Américo Rocha, Marechal Hermes",50 m²,2,1,1
R$ 3.000 /mês,R$ 155,"Rua Luiz Beltrão, Vila Valqueire",282 m²,2,3,1
R$ 750 /mês,R$ 250,"Estrada dos Caboclos, Campo Grande",55 m²,2,1,1
R$ 2.900 /mês,R$ 800,"Rua Senador Vergueiro, Flamengo",90 m²,2,1,1
R$ 3.200 /mês,R$ 769,"Rua Duvivier, Copacabana",107 m²,3,0,1
R$ 1.800 /mês,R$ 500,"Rua Sampaio Viana, Tijuca",70 m²,2,1,1
R$ 1.980 /mês,R$ 500,"Rua Maria José, Oswaldo Cruz",63 m²,2,1,1
R$ 2.100 /mês,0,"Rua Pedro de Carvalho, Méier",81 m²,4,1,3
R$ 1.110 /mês,R$ 300,"Estrada Adhemar Bebiano, Del Castilho",70 m²,2,2,1
R$ 3.200 /mês,R$ 1.800,"Rua General Barbosa Lima, Copacabana",160 m²,3,1,3
R$ 2.200 /mês,R$ 600,"Rua Assunção, Botafogo",50 m²,1,1,1
R$ 1.310 /mês,R$ 370,"Rua São Gabriel, Cachambi",95 m²,2,1,1
R$ 1.500 /mês,R$ 26,"Rua Viúva Dantas, Campo Grande",300 m²,2,1,2
R$ 5.000 /mês,R$ 1.137,"Rua Jorge Emílio Fontenelle, Recreio Dos Bandeirantes",400 m²,3,3,5
R$ 2.700 /mês,R$ 738,"Anil, Rio de Janeiro",77 m²,2,2,2
R$ 600 /mês,R$ 309,"Guaratiba, Rio de Janeiro",50 m²,2,1,2
R$ 1.000 /mês,R$ 480,"Rua Borja Reis, Engenho De Dentro",50 m²,2,1,1
R$ 10.500 /mês,R$ 467,"Rua São João Batista, Botafogo",120 m²,0,0,1
R$ 5.200 /mês,R$ 1.600,"Barra da Tijuca, Rio de Janeiro",70 m²,2,2,2
R$ 300.000 /mês,R$ 226.642,"Rua Pedro Alves, Santo Cristo",9000 m²,0,30,10
R$ 2.420 /mês,R$ 567,"Anil, Rio de Janeiro",60 m²,2,1,2
R$ 1.000 /mês,R$ 642,"Rua Barão, Taquara",120 m²,2,1,1
R$ 100 /mês,R$ 426,"Avenida Presidente Vargas, Centro",27 m²,0,0,1
R$ 900 /mês,R$ 250,"Rua Caetano da Silva, Cascadura",50 m²,2,1,1
R$ 4.000 /mês,R$ 1.000,"Avenida Epitácio Pessoa, Lagoa",80 m²,1,1,2
R$ 2.800 /mês,R$ 1.100,"Rua César Lattes, Barra da Tijuca",70 m²,2,1,3
R$ 3.400 /mês,R$ 790,"Avenida Embaixador Abelardo Bueno, Jacarepaguá",70 m²,2,1,2
R$ 3.400 /mês,R$ 1.300,"Rua Clarice Índio do Brasil, Botafogo",85 m²,2,1,1
R$ 900 /mês,R$ 600,"Rua D, Engenho De Dentro",90 m²,2,1,2
R$ 950 /mês,R$ 286,"Rua dos Inválidos, Centro",28 m²,0,0,1
R$ 1.800 /mês,R$ 700,"Rua Desembargador Izidro, Tijuca",63 m²,2,1,2
R$ 2.500 /mês,R$ 820,"Rua Paulino Fernandes, Botafogo",62 m²,2,1,2
R$ 780 /mês,R$ 660,"Centro, Rio de Janeiro",72 m²,2,1,1
R$ 3.500 /mês,R$ 480,"Rua Barão da Torre, Ipanema",56 m²,1,0,2
R$ 2.250 /mês,R$ 500,"Praça Pio XI, Jardim Botânico",40 m²,1,0,1
R$ 1.350 /mês,R$ 475,"Rua Coronel Almeida, Piedade",46 m²,2,1,1
R$ 600 /mês,R$ 370,"Rua Farmacêutico Silva Araújo, Taquara",28 m²,0,1,1
R$ 1.600 /mês,R$ 549,"Rua Bento Lisboa, Catete",42 m²,1,0,1
R$ 2.800 /mês,R$ 350,"Rua Jorge de Oliveira, Jardim Guanabara",200 m²,3,2,2
R$ 1.500 /mês,R$ 1.400,"Avenida Alfredo Balthazar da Silveira, Recreio Dos Bandeirantes",73 m²,2,2,3
R$ 920 /mês,R$ 500,"Avenida São Josemaria Escrivá, Itanhangá",58 m²,2,1,1
R$ 4.400 /mês,R$ 1.300,"Rua Teixeira Heizer, Recreio Dos Bandeirantes",144 m²,3,2,4
R$ 900 /mês,R$ 890,"Rua Isolina, Méier",60 m²,2,1,2
R$ 3.300 /mês,R$ 3.701,"Rua Domingos Ferreira, Copacabana",330 m²,5,0,3
R$ 1.900 /mês,0,"Rua Botucatu, Grumari",65 m²,2,1,0
R$ 2.300 /mês,R$ 600,"Rua Riachuelo, Centro",48 m²,1,0,1
R$ 4.000 /mês,R$ 1.150,"Rua Nascimento Bittencourt, Jardim Botânico",86 m²,2,1,1
R$ 3.575 /mês,R$ 813,"Anil, Rio de Janeiro",121 m²,2,3,3
R$ 2.000 /mês,R$ 415,"Rua João Vineli, Jardim Guanabara",80 m²,2,1,1
R$ 1.400 /mês,R$ 671,"Rua da Glória, Glória",49 m²,1,0,2
R$ 1.300 /mês,R$ 400,"Rua Irineu Correia, Irajá",70 m²,3,1,2
R$ 1.310 /mês,R$ 340,"Rua Frei Luiz Alevato, Taquara",48 m²,2,1,1
R$ 1.100 /mês,R$ 470,"Avenida Geremário Dantas, Pechincha",60 m²,1,1,2
R$ 1.200 /mês,R$ 470,"Rua Afonso Cavalcanti, Cidade Nova",53 m²,2,1,2
R$ 2.000 /mês,R$ 300,"Rua Anália Franco, Campinho",100 m²,3,1,2
R$ 4.000 /mês,R$ 1.250,"Rua Jardim Botânico, Jardim Botânico",60 m²,2,1,1
R$ 4.700 /mês,R$ 488,"Rua Gilberto Lannes, Jardim Guanabara",300 m²,3,3,4
R$ 33.000 /mês,R$ 4.972,"Avenida Ministro Edgard Romero, Madureira",1000 m²,0,4,5
R$ 4.180 /mês,R$ 1.112,"Estrada do Bananal, Freguesia- Jacarepaguá",162 m²,2,0,2
R$ 1.800 /mês,0,"Rua Divisória, Bento Ribeiro",85 m²,2,1,3
R$ 5.200 /mês,R$ 1.175,"Avenida Rainha Elizabeth da Bélgica, Ipanema",115 m²,3,1,3
R$ 2.500 /mês,0,"Rua Aylton Vasconcelos, Jardim Guanabara",130 m²,3,2,1
R$ 2.600 /mês,R$ 650,"Rua Gustavo Corção, Recreio Dos Bandeirantes",103 m²,3,2,2
R$ 2.200 /mês,R$ 394,"Avenida Geremário Dantas, Pechincha",53 m²,2,1,2
R$ 2.900 /mês,R$ 750,"Rua Pinto Alpoim, Jardim Guanabara",130 m²,3,2,4
R$ 1.900 /mês,R$ 670,"Avenida Nossa Senhora de Copacabana, Copacabana",47 m²,1,0,1
R$ 80.000 /mês,R$ 12.000,"Barra da Tijuca, Rio de Janeiro",1000 m²,0,0,1
R$ 12.000 /mês,R$ 1.766,"Rua Paulo César de Andrade, Laranjeiras",300 m²,4,2,3
R$ 2.300 /mês,R$ 800,"Rua Gaspar Magalhães, Jardim Guanabara",140 m²,3,2,3
R$ 1.300 /mês,R$ 954,"Rua Aquidabã, Méier",86 m²,2,1,3
R$ 1.100 /mês,R$ 685,"Rua Washington Luís, Centro",65 m²,2,0,2
R$ 2.500 /mês,R$ 526,"Rua A, Freguesia",72 m²,2,1,2
R$ 1.700 /mês,R$ 778,"Rua Aguiar, Tijuca",71 m²,2,1,1
R$ 2.000 /mês,R$ 1.530,"Rua Marques, Humaitá",80 m²,1,1,2
R$ 3.700 /mês,R$ 1.300,"Rua Clarice Índio do Brasil, Botafogo",94 m²,2,1,2
R$ 2.000 /mês,R$ 824,"Rua Doutor Satamini, Tijuca",80 m²,2,1,2
R$ 2.300 /mês,R$ 775,"Avenida Tim Maia, Recreio Dos Bandeirantes",66 m²,2,1,2
R$ 2.900 /mês,R$ 872,"Avenida Nossa Senhora de Copacabana, Copacabana",70 m²,2,0,2
R$ 1.500 /mês,R$ 992,"Avenida das Américas, Barra da Tijuca",35 m²,0,1,1
R$ 300 /mês,R$ 450,"Avenida Treze de Maio, Centro",20 m²,0,0,1
R$ 1.350 /mês,R$ 545,"Rua Caçu, Taquara",62 m²,2,1,2
R$ 1.200 /mês,R$ 530,"Rua Santo Amaro, Glória",45 m²,1,0,1
R$ 2.000 /mês,R$ 330,"Rua Grajaú, Grajaú",80 m²,3,0,1
R$ 720 /mês,R$ 250,"Travessa Paulino de Almeida, Campo Grande",54 m²,2,1,1
R$ 1.700 /mês,R$ 845,"Rua Torres Homem, Vila Isabel",73 m²,3,1,2
R$ 2.500 /mês,R$ 840,"Rua Siqueira Campos, Copacabana",60 m²,2,1,1
R$ 1.300 /mês,R$ 250,"Estrada da Boiuna, Taquara",120 m²,2,1,1
R$ 2.500 /mês,R$ 675,"Avenida São Sebastião, Urca",64 m²,2,0,2
R$ 1.900 /mês,R$ 950,"Rua Aroazes, Barra da Tijuca",80 m²,2,1,1
R$ 2.000 /mês,R$ 590,"Rua Daniel Barreto dos Santos, Vargem Pequena",108 m²,2,1,2
R$ 12.500 /mês,R$ 2.567,"Rua Almirante Guilhem, Leblon",140 m²,3,2,5
R$ 900 /mês,R$ 490,"Tijuca, Rio de Janeiro",34 m²,1,0,1
R$ 2.500 /mês,R$ 980,"Rua Dona Mariana, Botafogo",74 m²,2,2,1
R$ 1.100 /mês,R$ 400,"Rua Mário Calderaro, Engenho De Dentro",93 m²,2,1,3
R$ 1.900 /mês,R$ 479,"Praça André Rebouças, Maracanã",75 m²,2,0,2
R$ 2.500 /mês,R$ 50,"Rua Carvalho Alvim, Tijuca",72 m²,2,0,1
R$ 1.900 /mês,0,"Avenida Dom Hélder Câmara, Cachambi",57 m²,2,1,2
R$ 4.000 /mês,R$ 360,"Praia do Flamengo, Flamengo",35 m²,1,0,1
R$ 700 /mês,R$ 190,"Santíssimo, Rio de Janeiro",49 m²,2,1,1
R$ 2.500 /mês,R$ 841,"Rua Vicente Leporace, Recreio Dos Bandeirantes",115 m²,3,3,2
R$ 1.000 /mês,R$ 129,"Rua Juranda, Curicica",120 m²,2,0,1
R$ 1.300 /mês,0,"Caminho do Veloso, Campo Grande",100 m²,2,4,2
R$ 2.270 /mês,R$ 1.800,"Avenida Epitácio Pessoa, Lagoa",50 m²,1,1,1
R$ 1.500 /mês,R$ 940,"Rua Uruguai, Tijuca",75 m²,2,1,2
R$ 1.800 /mês,R$ 513,"Rua Retiro dos Artistas, Pechincha",65 m²,2,1,2
R$ 3.600 /mês,R$ 1.300,"Rua Clarice Índio do Brasil, Botafogo",94 m²,2,1,2
R$ 1.000 /mês,R$ 378,"Rua André Rocha, Taquara",24 m²,0,1,1
R$ 1.500 /mês,R$ 598,"Rua Teodoro da Silva, Vila Isabel",70 m²,1,1,2
R$ 1.100 /mês,R$ 747,"Rua São Francisco Xavier, São Francisco Xavier",63 m²,3,1,1
R$ 1.200 /mês,0,"Estrada Roberto Burle Marx, Guaratiba",100 m²,2,1,1
R$ 2.950 /mês,R$ 445,"Rua João Alfredo, Tijuca",112 m²,3,1,2
R$ 2.500 /mês,R$ 866,"Rua Rainha Guilhermina, Leblon",44 m²,1,0,1
R$ 2.000 /mês,R$ 365,"Rua das Laranjeiras, Laranjeiras",38 m²,1,1,1
R$ 30.000 /mês,R$ 13.728,"Rua Tiboim, Penha",1161 m²,0,0,0
R$ 1.400 /mês,R$ 352,"Rua Barata Ribeiro, Copacabana",27 m²,0,0,1
R$ 1.000 /mês,R$ 817,"Rua Adriano, Méier",53 m²,2,1,2
R$ 1.000 /mês,R$ 836,"Rua Venâncio Ribeiro, Engenho De Dentro",73 m²,2,1,1
R$ 1.430 /mês,R$ 495,"Praça Seca, Rio de Janeiro",64 m²,2,1,2
R$ 1.280 /mês,R$ 535,"Rua Riachuelo, Centro",55 m²,2,0,2
R$ 1.300 /mês,R$ 666,"Avenida Embaixador Abelardo Bueno, Barra da Tijuca",60 m²,2,1,1
R$ 1.500 /mês,R$ 330,"Avenida Passos, Centro",29 m²,0,0,1
R$ 1.650 /mês,R$ 600,"Rua Professor Henrique Costa, Pechincha",68 m²,2,1,2
R$ 1.300 /mês,R$ 351,"Rua Torres Homem, Vila Isabel",60 m²,1,1,1
R$ 5.000 /mês,R$ 4.169,"Rua do Carmo, Centro",225 m²,0,0,3
R$ 3.350 /mês,R$ 1.920,"Avenida Rio Branco, Centro",99 m²,0,0,0
R$ 2.200 /mês,R$ 560,"Rua Visconde de Abaeté, Vila Isabel",91 m²,2,2,2
R$ 3.900 /mês,R$ 656,"Anil, Rio de Janeiro",137 m²,3,1,2
R$ 2.200 /mês,R$ 815,"Rua Cândido Mendes, Glória",82 m²,2,1,2
R$ 1.350 /mês,R$ 551,"Rua Barata Ribeiro, Copacabana",60 m²,0,0,2
R$ 1.700 /mês,R$ 82,"Rua E, Engenho De Dentro",100 m²,2,2,1
R$ 1.750 /mês,R$ 500,"Rua Orestes Barbosa, Jardim Guanabara",78 m²,2,1,2
R$ 1.900 /mês,R$ 570,"Rua Belarmino de Matos, Irajá",90 m²,2,1,1
R$ 2.200 /mês,R$ 855,"Rua Almirante Baltazar, São Cristóvão",83 m²,3,1,1
R$ 1.800 /mês,0,"Rua Vereador Alexandrino Soares, Irajá",75 m²,2,1,1
R$ 1.200 /mês,R$ 400,"Rua General Ivo Soares, Taquara",55 m²,2,1,1
R$ 2.850 /mês,R$ 750,"Avenida Henrique Dumont, Ipanema",48 m²,1,0,1
R$ 1.300 /mês,R$ 485,"Avenida Meriti, Vila da Penha",70 m²,2,1,2
R$ 13.000 /mês,R$ 8.664,"Rua São José, Centro",447 m²,0,0,7
R$ 3.100 /mês,R$ 65,"Rua Artur Menezes, Maracanã",80 m²,2,0,2
R$ 2.200 /mês,R$ 925,"Rua das Palmeiras, Botafogo",50 m²,1,1,2
R$ 1.600 /mês,R$ 485,"Rua General Roca, Tijuca",60 m²,2,1,1
R$ 1.300 /mês,R$ 440,"Rua Cruz e Sousa, Piedade",54 m²,1,1,1
R$ 2.200 /mês,R$ 400,"Rua A, Pechincha",55 m²,2,1,2
R$ 1.980 /mês,R$ 750,"Rua Serrão, Jardim Guanabara",80 m²,3,1,3
R$ 704 /mês,R$ 246,"Estrada do Pre, Campo Grande",52 m²,2,1,1
R$ 900 /mês,R$ 635,"Avenida José Silva de Azevedo Neto, Barra da Tijuca",21 m²,0,1,1
R$ 1.000 /mês,R$ 560,"Rua Piauí, Todos os Santos",55 m²,2,1,1
R$ 1.300 /mês,R$ 500,"Estrada Japore, Jardim Sulacap",66 m²,2,1,2
R$ 1.400 /mês,R$ 340,"Rua Pojuca, Ribeira",65 m²,2,1,1
R$ 680 /mês,R$ 320,"Caminho do Veloso, Campo Grande",60 m²,2,1,1
R$ 1.400 /mês,R$ 590,"Avenida Salvador Allende, Jacarepaguá",51 m²,2,1,1
R$ 2.000 /mês,R$ 600,"Rua Santa Clara, Copacabana",45 m²,1,0,1
R$ 650 /mês,R$ 582,"Rua Dois de Fevereiro, Encantado",35 m²,1,1,1
R$ 1.200 /mês,R$ 360,"Rua Bispo Lacerda, Del Castilho",60 m²,2,1,2
R$ 2.750 /mês,R$ 740,"Rua Dias Ferreira, Leblon",45 m²,1,0,1
R$ 3.600 /mês,R$ 1.428,"Rua Batista da Costa, Lagoa",95 m²,2,1,1
R$ 30.000 /mês,R$ 5.700,"Avenida Vieira Souto, Ipanema",330 m²,4,3,5
R$ 2.420 /mês,0,"Cordovil, Rio de Janeiro",60 m²,0,0,1
R$ 14.000 /mês,R$ 4.337,"Ipanema, Rio de Janeiro",205 m²,3,2,3
R$ 1.200 /mês,R$ 310,"Rua Castorino Francisco Nunes, Pitangueiras",45 m²,2,1,1
R$ 1.500 /mês,R$ 537,"Rua Fortunato de Brito, Freguesia- Jacarepaguá",66 m²,2,1,1
R$ 1.900 /mês,R$ 750,"Rua Araguaia, Freguesia",79 m²,2,1,3
R$ 700 /mês,R$ 350,"Rua México, Centro",33 m²,0,0,1
R$ 2.500 /mês,R$ 650,"Rua Bom Retiro, Jardim Guanabara",120 m²,3,1,3
R$ 2.100 /mês,R$ 585,"Avenida Nossa Senhora de Copacabana, Copacabana",47 m²,1,1,1
R$ 3.500 /mês,R$ 300,"Rua Presidente Alfonso López, Lagoa",78 m²,2,0,2
R$ 1.012 /mês,R$ 388,"Estrada do Colégio, Colégio",50 m²,2,1,1
R$ 1.210 /mês,R$ 499,"Rua Albano, Praça Seca",60 m²,2,1,2
R$ 1.000 /mês,R$ 462,"Rua A, Taquara",55 m²,2,1,2
R$ 1.200 /mês,R$ 705,"Rua São Francisco Xavier, São Francisco Xavier",56 m²,2,1,2
R$ 2.000 /mês,R$ 550,"Rua Raimundo Correia, Copacabana",47 m²,1,0,2
R$ 1.800 /mês,0,"Rua João Cirilo de Oliveira, Campo Grande",150 m²,2,2,2
R$ 1.900 /mês,R$ 1.008,"Rua Engenheiro Enaldo Cravo Peixoto, Tijuca",73 m²,2,1,3
R$ 1.600 /mês,R$ 725,"Rua Fábio Luz, Méier",68 m²,2,1,1
R$ 1.000 /mês,R$ 610,"Estrada do Tindiba, Taquara",100 m²,2,1,1
R$ 2.200 /mês,R$ 109,"Rua Meira de Vasconcelos, Grajaú",120 m²,2,0,2
R$ 1.600 /mês,R$ 650,"Rua Orestes Rosolia, Jardim Guanabara",78 m²,2,1,2
R$ 2.500 /mês,R$ 900,"Rua Professor Gabizo, Tijuca",70 m²,2,1,3
R$ 2.400 /mês,R$ 1.100,"Rua Jornalista Henrique Cordeiro, Barra da Tijuca",90 m²,3,1,2
R$ 1.300 /mês,R$ 361,"Rua Monclaro Mena Barreto, Vila Valqueire",67 m²,2,2,2
R$ 20.000 /mês,R$ 4.239,"Rua Visconde de Inhaúma, Centro",640 m²,0,8,3
R$ 10.500 /mês,R$ 5.600,"Barra da Tijuca, Rio de Janeiro",202 m²,0,7,1
R$ 700 /mês,R$ 370,"Avenida Geremário Dantas, Pechincha",25 m²,0,1,1
R$ 1.375 /mês,0,"Rua Embu-Guaçu, Campo Grande",80 m²,3,2,2
R$ 3.800 /mês,R$ 224,"Avenida Gaspar de Lemos, Guaratiba",180 m²,4,1,3
R$ 1.300 /mês,R$ 650,"Rua Ferreira Pontes, Andaraí",80 m²,2,1,2
R$ 900 /mês,R$ 748,"Rua São Francisco Xavier, Maracanã",65 m²,2,1,2
R$ 2.500 /mês,R$ 850,"Avenida das Américas, Barra da Tijuca",50 m²,0,1,0
R$ 1.300 /mês,0,"Rua Clara Nunes, Madureira",80 m²,2,0,1
R$ 2.000 /mês,R$ 125,"Praça Seca, Rio de Janeiro",100 m²,3,1,1
R$ 1.383 /mês,R$ 350,"Rua Barbosa da Silva, Engenho Novo",65 m²,2,1,2
R$ 2.200 /mês,R$ 500,"Rua da Passagem, Botafogo",47 m²,1,1,1
R$ 2.700 /mês,R$ 729,"Rua Barata Ribeiro, Copacabana",84 m²,2,0,1
R$ 500 /mês,R$ 750,"Rua Buenos Aires, Centro",28 m²,0,0,1
R$ 2.700 /mês,R$ 894,"Avenida Ruy Antunes Correa, Barra da Tijuca",70 m²,2,1,2
R$ 1.300 /mês,R$ 798,"Rua Luís Barbosa, Vila Isabel",81 m²,2,1,3
R$ 6.000 /mês,R$ 1.930,"Rua Prudente de Morais, Ipanema",91 m²,2,1,3
R$ 2.100 /mês,R$ 545,"Rua Baltazar Lisboa, Vila Isabel",55 m²,2,1,2
R$ 1.600 /mês,R$ 80,"Estrada do Mendanha, Campo Grande",134 m²,3,1,3
R$ 1.150 /mês,R$ 410,"Rua General Roca, Tijuca",45 m²,1,1,1
R$ 3.600 /mês,R$ 1.300,"Botafogo, Rio de Janeiro",94 m²,2,1,2
R$ 900 /mês,R$ 406,"Rua Vinte e Quatro de Maio, Sampaio",49 m²,2,1,1
R$ 1.200 /mês,R$ 221,"Rua Almirante Calheiros da Graça, Méier",83 m²,2,1,1
R$ 5.500 /mês,R$ 514,"Rua Jurupari, Tijuca",155 m²,1,0,2
R$ 8.000 /mês,R$ 2.726,"Rua Dezenove de Fevereiro, Botafogo",283 m²,0,0,2
R$ 3.000 /mês,R$ 330,"Penha, Rio de Janeiro",97 m²,0,0,2
R$ 4.300 /mês,0,"Avenida Prefeito Dulcídio Cardoso, Barra da Tijuca",100 m²,3,2,3
R$ 2.835 /mês,R$ 765,"Rua Barão de Mesquita, Tijuca",70 m²,2,1,2
R$ 780 /mês,R$ 260,"Rua Severino Ferreira da Costa, Campo Grande",52 m²,2,2,1
R$ 4.200 /mês,R$ 1.324,"Rua Clarice Índio do Brasil, Botafogo",101 m²,2,1,3
R$ 2.830 /mês,R$ 750,"Rua Cândido Mendes, Glória",75 m²,2,1,2
R$ 3.000 /mês,R$ 997,"Rua da Passagem, Botafogo",73 m²,2,1,2
R$ 500 /mês,R$ 333,"Rua Araguaia, Freguesia- Jacarepaguá",27 m²,0,0,1
R$ 1.700 /mês,0,"Estrada do Vidigal, Vidigal",50 m²,1,1,1
R$ 1.600 /mês,0,"Rua Lírio do Vale, Campo Grande",80 m²,2,1,2
R$ 650 /mês,R$ 63,"Caminho do Veloso, Campo Grande",69 m²,2,0,1
R$ 2.725 /mês,R$ 900,"Avenida Tim Maia, Recreio Dos Bandeirantes",81 m²,2,1,2
R$ 2.500 /mês,R$ 900,"Rua Lauro Muller, Botafogo",72 m²,2,1,1
R$ 1.750 /mês,R$ 450,"Estrada Roberto Burle Marx, Guaratiba",70 m²,1,3,1
R$ 1.300 /mês,R$ 400,"Estrada do Quitungo, Penha",120 m²,3,1,2
R$ 2.200 /mês,R$ 893,"Rua Garibaldi, Tijuca",80 m²,2,1,2
R$ 700 /mês,R$ 430,"Rua Araguaia, Freguesia- Jacarepaguá",23 m²,0,1,1
R$ 1.900 /mês,R$ 830,"Rua Araújo Lima, Tijuca",92 m²,3,2,1
R$ 1.000 /mês,R$ 270,"Caminho do Veloso, Campo Grande",50 m²,2,0,1
R$ 1.800 /mês,R$ 598,"Rua Monsenhor Magaldi, Jardim Guanabara",70 m²,2,1,2
R$ 300 /mês,R$ 485,"Rua Carvalho de Souza, Madureira",20 m²,0,0,0
R$ 1.000 /mês,R$ 749,"Rua São Francisco Xavier, São Francisco Xavier",64 m²,2,1,3
R$ 25.000 /mês,R$ 4.932,"Rua Maba, Parada de Lucas",3000 m²,0,6,6
R$ 6.500 /mês,0,"Rua São Francisco Xavier, Maracanã",196 m²,1,0,3
R$ 1.700 /mês,R$ 946,"Rua Fábio Luz, Méier",119 m²,3,1,3
R$ 1.700 /mês,R$ 469,"Rua das Laranjeiras, Laranjeiras",47 m²,1,0,2
R$ 1.000 /mês,R$ 346,"Praça Seca, Rio de Janeiro",58 m²,2,1,1
R$ 4.500 /mês,R$ 100,"Estrada do Morro Cavado, Guaratiba",350 m²,5,2,6
R$ 1.870 /mês,R$ 150,"Rua Piauí, Todos os Santos",80 m²,2,1,2
R$ 2.869 /mês,R$ 728,"Avenida Alfredo Balthazar da Silveira, Recreio Dos Bandeirantes",100 m²,3,2,3
R$ 1.600 /mês,0,"Rua Mandina, Taquara",100 m²,2,0,1
R$ 1.000 /mês,R$ 190,"Rua Figueiredo Pimentel, Piedade",70 m²,2,2,2
R$ 1.000 /mês,R$ 150,"Rua Diomedes Trota, Ramos",59 m²,2,0,1
R$ 1.000 /mês,R$ 455,"Rua André Rocha, Taquara",50 m²,2,1,1
R$ 900 /mês,R$ 405,"Rua Haddock Lobo, Tijuca",27 m²,0,1,1
R$ 1.800 /mês,R$ 650,"Rua Conde de Bonfim, Tijuca",95 m²,3,1,1
R$ 1.350 /mês,R$ 730,"Estrada de Jacarepaguá, Freguesia- Jacarepaguá",67 m²,2,1,1
R$ 2.200 /mês,R$ 10,"Rua Ajurana, Campo Grande",95 m²,2,2,3
R$ 3.500 /mês,R$ 1.000,"Avenida Ministro Ary Franco, Bangu",280 m²,2,1,2
R$ 3.800 /mês,R$ 1.967,"Avenida General Olyntho Pillar, Barra da Tijuca",129 m²,3,2,2
R$ 650 /mês,R$ 300,"Rua Padre André Moreira, Méier",50 m²,1,1,1
R$ 3.000 /mês,R$ 1.038,"Rua J. Carlos, Jardim Botânico",75 m²,2,1,2
R$ 1.250 /mês,R$ 485,"Rua Monte Santo, Irajá",50 m²,2,1,1
R$ 2.800 /mês,R$ 740,"Rua Breno Guimarães, Jardim Guanabara",109 m²,3,2,3
R$ 1.300 /mês,R$ 320,"Avenida Braz de Pina, Vista Alegre",70 m²,2,1,2
R$ 2.200 /mês,R$ 481,"Rua Jaime Ovale, Jardim Guanabara",125 m²,3,2,3
R$ 1.000 /mês,R$ 750,"Rua Manuela Barbosa, Méier",27 m²,0,0,1
R$ 10.500 /mês,R$ 2.300,"Rua Souza Lima, Copacabana",220 m²,4,2,1
R$ 13.500 /mês,R$ 667,"Rua São João Batista, Botafogo",184 m²,0,0,2
R$ 1.300 /mês,R$ 550,"Rua C, Méier",78 m²,2,1,3
R$ 1.660 /mês,R$ 100,"Rua Elisa de Albuquerque, Méier",70 m²,2,1,2
R$ 1.000 /mês,R$ 620,"Rua Castro Alves, Méier",65 m²,2,1,2
R$ 1.100 /mês,R$ 418,"Avenida Tenente-Coronel Muniz de Aragão, Anil",46 m²,2,1,1
R$ 2.200 /mês,R$ 1.056,"Rua Sá Ferreira, Copacabana",78 m²,2,1,2
R$ 800 /mês,R$ 350,"Estrada do Tindiba, Taquara",25 m²,0,1,1
R$ 700 /mês,R$ 360,"Estrada Professor Daltro Santos, Campo Grande",49 m²,2,1,2
R$ 800 /mês,0,"Rua Murilo Alvarenga, Campo Grande",50 m²,2,1,1
R$ 700 /mês,0,"Rua Esperança, Inhoaíba",45 m²,2,1,1
R$ 1.900 /mês,R$ 830,"Rua Desembargador Paulo Alonso, Recreio Dos Bandeirantes",70 m²,2,1,2
R$ 3.200 /mês,R$ 850,"Rua Antônio Parreiras, Ipanema",80 m²,2,1,2
R$ 3.500 /mês,R$ 1.369,"Rua Clarice Índio do Brasil, Botafogo",59 m²,2,1,3
R$ 980 /mês,R$ 430,"Rua Fábio Luz, Méier",70 m²,2,1,1
R$ 2.800 /mês,R$ 1.100,"Leblon, Rio de Janeiro",70 m²,2,0,1
R$ 2.300 /mês,R$ 865,"Rua Barata Ribeiro, Copacabana",70 m²,2,1,1
R$ 1.700 /mês,R$ 550,"Rua Professor Henrique Costa, Pechincha",60 m²,2,1,1
R$ 1.417 /mês,0,"Rua Miranda e Brito, Irajá",100 m²,2,1,1
R$ 4.060 /mês,R$ 850,"Rua Álvaro Ramos, Botafogo",90 m²,2,1,2
R$ 3.500 /mês,R$ 500,"Praça Pio XI, Jardim Botânico",70 m²,2,1,1
R$ 1.200 /mês,R$ 350,"Rua Araguaia, Freguesia- Jacarepaguá",69 m²,2,0,2
R$ 800 /mês,R$ 450,"Estrada do Tindiba, Taquara",36 m²,0,0,1
R$ 11.500 /mês,R$ 1.400,"Estrada dos Bandeirantes, Camorim",440 m²,0,0,2
R$ 10.000 /mês,R$ 1.750,"Rua Filgueiras Lima, Riachuelo",106 m²,0,0,0
R$ 8.500 /mês,R$ 1.000,"Rua Redentor, Ipanema",150 m²,3,1,3
R$ 1.210 /mês,R$ 499,"Rua Albano, Praça Seca",62 m²,2,1,2
R$ 2.790 /mês,R$ 534,"Alameda A, Recreio Dos Bandeirantes",84 m²,3,2,2
R$ 1.260 /mês,R$ 220,"Rua Ouro Preto, Quintino Bocaiúva",85 m²,2,1,3
R$ 500 /mês,R$ 379,"Rua Buenos Aires, Centro",29 m²,0,0,1
R$ 1.500 /mês,R$ 270,"Alameda A, Recreio Dos Bandeirantes",45 m²,2,1,1
R$ 2.200 /mês,R$ 889,"Avenida Nossa Senhora de Copacabana, Leme",70 m²,2,0,1
R$ 1.850 /mês,R$ 475,"Rua Dom Emanuel Gomes, Jardim Guanabara",75 m²,2,1,1
R$ 1.300 /mês,R$ 360,"Avenida Meriti, Irajá",45 m²,2,1,1
R$ 750 /mês,R$ 311,"Estrada Pau-ferro, Pechincha",32 m²,0,1,1
R$ 650 /mês,R$ 575,"Rua Senador Dantas, Centro",33 m²,0,0,1
R$ 2.900 /mês,R$ 1.659,"Avenida Lúcio Costa, Barra da Tijuca",55 m²,1,1,1
R$ 1.950 /mês,R$ 465,"Rua Ministro Viveiros de Castro, Copacabana",33 m²,1,0,1
R$ 2.600 /mês,R$ 1.000,"Rua Paulo Moura, Barra da Tijuca",80 m²,2,1,2
R$ 900 /mês,R$ 605,"Avenida Nossa Senhora de Copacabana, Copacabana",22 m²,0,0,1
R$ 2.700 /mês,R$ 84,"Rua Luís Severiano Ribeiro, Freguesia",94 m²,2,2,2
R$ 2.800 /mês,R$ 600,"Rua Voluntários da Pátria, Botafogo",103 m²,2,0,2
R$ 1.870 /mês,R$ 120,"Estrada Adhemar Bebiano, Del Castilho",300 m²,2,3,2
R$ 1.000 /mês,R$ 384,"Rua Antônio Cordeiro, Freguesia",53 m²,2,1,1
R$ 1.100 /mês,R$ 367,"Rua A, Freguesia",50 m²,2,1,1
R$ 1.500 /mês,R$ 75,"Avenida Ministro Edgard Romero, Madureira",120 m²,2,1,3
R$ 1.650 /mês,R$ 650,"Rua Iriquitia, Taquara",80 m²,2,1,2
R$ 1.800 /mês,R$ 295,"Rua General Polidoro, Botafogo",69 m²,2,0,2
R$ 120 /mês,R$ 58,"Saúde, Rio de Janeiro",15 m²,0,0,1
R$ 4.647 /mês,R$ 862,"Barra da Tijuca, Rio de Janeiro",30 m²,0,4,0
R$ 2.400 /mês,R$ 711,"Rua Ubaldino do Amaral, Centro",73 m²,2,1,1
R$ 5.395 /mês,0,"Avenida Prefeito Dulcídio Cardoso, Barra da Tijuca",125 m²,4,2,3
R$ 2.000 /mês,0,"Rua Acarapé, Ricardo de Albuquerque",136 m²,4,0,2
R$ 7.500 /mês,R$ 1.255,"Rua Francisco Otaviano, Copacabana",103 m²,2,3,2
R$ 1.900 /mês,R$ 1.056,"Rua Dois de Dezembro, Catete",70 m²,2,0,2
R$ 900 /mês,R$ 600,"Rua Chaves Pinheiro, Cachambi",66 m²,2,1,2
R$ 1.700 /mês,R$ 350,"Travessa da Brandura, Irajá",70 m²,2,1,3
R$ 1.100 /mês,R$ 533,"Rua Haddock Lobo, Estacio",50 m²,2,0,1
R$ 1.600 /mês,R$ 995,"Rua Senador Nabuco, Vila Isabel",94 m²,2,1,2
R$ 3.100 /mês,R$ 1.018,"Botafogo, Rio de Janeiro",71 m²,2,1,2
R$ 2.000 /mês,R$ 574,"Rua Barão de Mesquita, Tijuca",66 m²,2,1,1
R$ 350 /mês,R$ 340,"Estrada Marechal Miguel Salazar Mendes de Morais, Taquara",25 m²,0,1,1
R$ 6.000 /mês,R$ 1.300,"Estrada dos Bandeirantes, Vargem Pequena",222 m²,4,3,3
R$ 1.700 /mês,R$ 504,"Rua Monsenhor Manuel Gomes, São Cristóvão",54 m²,2,1,2
R$ 480 /mês,R$ 519,"Rua Senador Dantas, Centro",33 m²,0,0,1
R$ 890 /mês,R$ 275,"Rua A, Guaratiba",63 m²,2,1,2
R$ 2.100 /mês,R$ 615,"Avenida Ernani Cardoso, Cascadura",80 m²,2,1,1
R$ 1.850 /mês,R$ 330,"Rua A, Irajá",70 m²,2,2,1
R$ 2.500 /mês,R$ 878,"Avenida Atlântica, Copacabana",55 m²,1,0,1
R$ 950 /mês,R$ 450,"Copacabana, Rio de Janeiro",35 m²,1,0,1
R$ 1.650 /mês,R$ 1.317,"Rua Sá Viana, Grajaú",90 m²,2,1,3
R$ 950 /mês,R$ 130,"Rua Oliveira Serpa, Maria da Graça",50 m²,1,0,1
R$ 1.265 /mês,R$ 500,"Rua Sousa Barros, Engenho Novo",70 m²,2,1,2
R$ 3.000 /mês,R$ 850,"Rua A, Jacarepaguá",68 m²,2,1,2
R$ 1.100 /mês,R$ 460,"Rua São José, Centro",30 m²,0,0,1
R$ 2.800 /mês,R$ 917,"Rua Barão de Pirassinunga, Tijuca",98 m²,3,1,2
R$ 3.000 /mês,R$ 638,"Rua Marechal Pires Ferreira, Laranjeiras",70 m²,1,1,1
R$ 1.400 /mês,R$ 35,"Rua Vina Del Mar, Campo Grande",100 m²,2,1,2
R$ 2.800 /mês,R$ 822,"Avenida José Luiz Ferraz, Recreio Dos Bandeirantes",91 m²,3,1,3
R$ 2.500 /mês,R$ 294,"Estrada do Galeão, Portuguesa",68 m²,2,1,2
R$ 1.000 /mês,R$ 640,"Rua Barão de São Francisco, Andaraí",58 m²,1,1,2
R$ 1.200 /mês,R$ 470,"Rua Flack, Engenho Novo",80 m²,2,1,1
R$ 58.000 /mês,0,"Rua Felizardo Fortes, Ramos",4400 m²,0,0,0
R$ 2.873 /mês,R$ 1.020,"Rua Muniz Barreto, Botafogo",90 m²,2,1,3
R$ 2.000 /mês,R$ 52,"Rua Vidal Ramos, Marechal Hermes",139 m²,2,1,2
R$ 3.000 /mês,R$ 650,"Rua Estácio Coimbra, Botafogo",64 m²,2,1,1
R$ 3.500 /mês,R$ 1.140,"Rua Gomes Carneiro, Ipanema",85 m²,2,0,1
R$ 3.350 /mês,R$ 860,"Rua Gustavo Sampaio, Leme",81 m²,2,1,1
R$ 1.015 /mês,R$ 250,"Rua Enaldo dos Santos Araújo, Engenheiro Leal",40 m²,2,1,1
R$ 1.100 /mês,R$ 220,"Avenida Marechal Rondon, São Francisco Xavier",60 m²,2,1,1
R$ 1.700 /mês,R$ 350,"Rua José Soares Ferreira, Campo Grande",90 m²,2,1,2
R$ 1.350 /mês,R$ 520,"Rua Piauí, Méier",48 m²,2,1,2
R$ 26.760 /mês,R$ 6.690,"Copacabana, Rio de Janeiro",223 m²,0,2,0
R$ 1.850 /mês,R$ 512,"Tijuca, Rio de Janeiro",61 m²,2,0,1
R$ 30.000 /mês,R$ 2.600,"Rua José Condé, Itanhangá",601 m²,4,4,4
R$ 1.200 /mês,R$ 520,"Avenida Pastor Martin Luther King Jr, Irajá",50 m²,2,1,1
R$ 1.700 /mês,R$ 364,"Rua Igarapé-Açu, Jacarepaguá",52 m²,2,1,1
R$ 1.400 /mês,R$ 295,"Rua Tenente Costa, Méier",70 m²,2,1,1
R$ 1.880 /mês,R$ 350,"Rua Haroldo Lobo, Portuguesa",93 m²,2,2,2
R$ 1.600 /mês,R$ 358,"Rua Torres Homem, Vila Isabel",75 m²,3,0,1
R$ 3.000 /mês,R$ 1.024,"Rua Professor Gastão Bahiana, Lagoa",85 m²,2,1,3
R$ 1.000 /mês,R$ 270,"Rua A, Campo Grande",45 m²,2,1,1
R$ 600 /mês,R$ 585,"Rua Buenos Aires, Centro",28 m²,0,1,1
R$ 2.890 /mês,R$ 950,"Rua Miguel Lemos, Copacabana",70 m²,2,1,1
R$ 2.000 /mês,0,"Rua Capitão Cruz, Parada de Lucas",300 m²,2,1,2
R$ 1.000 /mês,R$ 250,"Estrada do Campinho, Campo Grande",50 m²,2,1,1
R$ 1.400 /mês,R$ 492,"Rua Doutor Otávio Kelly, Tijuca",65 m²,2,1,2
R$ 900 /mês,R$ 300,"Rua Padre Peroneille, Jardim América",67 m²,2,1,2
R$ 1.508 /mês,R$ 280,"Rua Altinópolis, Praia da Bandeira",63 m²,2,1,1
R$ 935 /mês,R$ 350,"Rua do Cajá, Penha",60 m²,2,1,2
R$ 2.000 /mês,R$ 897,"Rua Barata Ribeiro, Copacabana",80 m²,2,0,2
R$ 1.650 /mês,R$ 350,"Rua Ana Silva, Pechincha",88 m²,2,1,3
R$ 1.500 /mês,R$ 550,"Rua Piauí, Todos os Santos",50 m²,2,1,2
R$ 1.020 /mês,R$ 383,"Rua Dagmar da Fonseca, Cascadura",67 m²,2,1,2
R$ 800 /mês,R$ 474,"Rua Hipólito da Costa, Vila Isabel",50 m²,2,0,1
