preco,condominio,endereço,area,quartos,vagas,banheiros
R$ 2.700 /mês,0,"Rua Álvaro Alvim, Centro",30 m²,1,0,1
R$ 4.000 /mês,R$ 1.576,"Ipanema, Rio de Janeiro",78 m²,2,1,3
R$ 2.600 /mês,R$ 2.236,"Rua Roberto Dias Lópes, Copacabana",82 m²,2,1,3
R$ 950 /mês,R$ 350,"Campo Grande, Rio de Janeiro",74 m²,3,1,1
R$ 1.000 /mês,R$ 565,"Rua Sete de Setembro, Centro",24 m²,1,0,1
R$ 1.400 /mês,R$ 491,"Avenida Nossa Senhora de Copacabana, Copacabana",36 m²,0,0,2
R$ 5.345 /mês,R$ 1.700,"Rua Teófilo Otoni, Centro",404 m²,0,0,4
R$ 5.500 /mês,0,"Rua José Bonifácio, Todos os Santos",74 m²,0,0,1
R$ 1.500 /mês,R$ 500,"Praça Vereador Rocha Leão, Copacabana",30 m²,1,0,1
R$ 800 /mês,R$ 95,"Rua Paulo de Sousa Reis, Oswaldo Cruz",33 m²,1,0,1
R$ 720 /mês,R$ 530,"Rua Professor Plínio Bastos, Olaria",38 m²,1,1,1
R$ 1.400 /mês,R$ 310,"Rua Senador Vergueiro, Flamengo",25 m²,1,0,1
R$ 1.100 /mês,R$ 681,"Rua Barão de Mesquita, Andaraí",60 m²,2,0,1
R$ 680 /mês,R$ 252,"Rua Americana, Cachambi",40 m²,1,0,1
R$ 800 /mês,R$ 800,"Avenida Nossa Senhora de Copacabana, Copacabana",35 m²,0,0,1
R$ 1.700 /mês,R$ 950,"Avenida Rio Branco, Centro",44 m²,0,0,1
R$ 850 /mês,R$ 400,"Recreio Dos Bandeirantes, Rio de Janeiro",23 m²,1,1,0
R$ 300 /mês,R$ 760,"Avenida Graça Aranha, Centro",53 m²,0,0,2
R$ 600 /mês,R$ 670,"Rua Dois de Fevereiro, Engenho De Dentro",40 m²,1,1,1
R$ 700 /mês,0,"Rua Araçoiaba, Marechal Hermes",55 m²,1,0,1
R$ 1.350 /mês,R$ 500,"Rua Roberval Cordeiro de Farias, Recreio Dos Bandeirantes",33 m²,1,0,0
R$ 1.100 /mês,R$ 153,"Rua Juiz de Fora, Grajaú",25 m²,0,0,1
R$ 1.500 /mês,R$ 749,"Rua Grajaú, Grajaú",52 m²,2,0,1
R$ 2.000 /mês,R$ 1.441,"Avenida Luís Carlos Prestes, Barra da Tijuca",45 m²,0,2,1
R$ 650 /mês,0,"Rua Anhambai, Cordovil",60 m²,1,0,1
R$ 800 /mês,R$ 16,"Rua Moçambique, Rocha Miranda",60 m²,2,0,1
R$ 850 /mês,R$ 50,"Rua Moisés Lilenbaum, Quintino Bocaiúva",42 m²,2,0,1
R$ 1.000 /mês,R$ 400,"Avenida Princesa Isabel, Copacabana",35 m²,0,0,1
R$ 2.000 /mês,R$ 1.366,"Avenida Embaixador Abelardo Bueno, Barra da Tijuca",48 m²,0,1,1
R$ 1.122 /mês,R$ 757,"Avenida Pedro II, São Cristóvão",75 m²,3,0,1
R$ 600 /mês,0,"Rua Isis, Curicica",45 m²,1,0,1
R$ 1.500 /mês,R$ 500,"Avenida Nossa Senhora de Copacabana, Copacabana",34 m²,1,0,1
R$ 1.500 /mês,R$ 1.370,"Avenida das Américas, Barra da Tijuca",34 m²,0,1,1
R$ 750 /mês,R$ 130,"Rua Aristóteles, Rocha Miranda",46 m²,1,0,1
R$ 1.150 /mês,R$ 1.200,"Rua José Higino, Tijuca",65 m²,1,1,1
R$ 900 /mês,R$ 90,"Rua Itamarati, Cascadura",70 m²,2,0,1
R$ 1.000 /mês,R$ 550,"Rua das Laranjeiras, Laranjeiras",25 m²,1,0,1
R$ 600 /mês,R$ 150,"Rua Benjamim de Magalhães, Pilares",62 m²,1,0,1
R$ 2.000 /mês,R$ 1.000,"Rua Siqueira Campos, Copacabana",30 m²,0,0,1
R$ 2.500 /mês,R$ 2.121,"Rua São José, Centro",104 m²,0,0,2
R$ 600 /mês,R$ 1.260,"Rua da Assembléia, Centro",42 m²,0,0,1
R$ 960 /mês,R$ 532,"Rua do Matoso, Rio Comprido",34 m²,1,0,1
R$ 3.300 /mês,R$ 1.600,"Avenida Paulo de Frontin, Rio Comprido",190 m²,4,1,3
R$ 700 /mês,R$ 738,"Rua Belfort Roxo, Copacabana",20 m²,0,0,1
R$ 5.500 /mês,R$ 1.000,"Freguesia- Jacarepaguá, Rio de Janeiro",100 m²,0,0,2
R$ 5.000 /mês,R$ 2.310,"Avenida Lineu de Paula Machado, Lagoa",127 m²,2,2,1
R$ 2.800 /mês,0,"Rua Engenheiro Alberto Haas, Jacaré",1000 m²,1,10,3
R$ 1.600 /mês,R$ 900,"Avenida Almirante Barroso, Centro",55 m²,0,0,1
R$ 1.000 /mês,R$ 50,"Rua Conceiçao das Alagoas, Campo Grande",96 m²,2,0,1
R$ 561 /mês,R$ 268,"Rua Antônio Carlos Belchior, Campo Grande",40 m²,2,0,1
R$ 900 /mês,R$ 500,"Rua São Cristóvão, São Cristóvão",29 m²,0,0,1
R$ 800 /mês,0,"Rua Coelho Lisboa, Oswaldo Cruz",43 m²,1,0,1
R$ 2.000 /mês,R$ 902,"Barra da Tijuca, Rio de Janeiro",50 m²,0,1,1
R$ 1.800 /mês,R$ 891,"Rua Anfilófio de Carvalho, Centro",60 m²,0,0,1
R$ 1.200 /mês,0,"Rua Eneida de Morais, Jardim Carioca",45 m²,1,0,1
R$ 3.000 /mês,R$ 1.000,"Travessa Tamoios, Flamengo",55 m²,2,0,1
R$ 2.000 /mês,R$ 1.000,"Barra da Tijuca, Rio de Janeiro",71 m²,0,0,1
R$ 10.000 /mês,R$ 477,"Avenida João Ribeiro, Pilares",397 m²,0,0,0
R$ 1.300 /mês,R$ 700,"Avenida Pastor Martin Luther King Jr, Del Castilho",30 m²,0,1,1
R$ 1.200 /mês,R$ 510,"Rua Barata Ribeiro, Copacabana",31 m²,1,0,1
R$ 800 /mês,R$ 293,"Jacarepaguá, Rio de Janeiro",19 m²,0,1,1
R$ 2.300 /mês,R$ 770,"Rua das Laranjeiras, Laranjeiras",28 m²,0,0,0
R$ 3.200 /mês,R$ 288,"Estrada Intendente Magalhães, Campinho",60 m²,3,1,2
R$ 12.000 /mês,R$ 600,"Rua Xavier da Silveira, Copacabana",140 m²,0,0,4
R$ 6.800 /mês,R$ 1.740,"Rua Belisário Pena, Penha",600 m²,0,0,4
R$ 18.500 /mês,R$ 2.800,"Rua Joana Angélica, Ipanema",170 m²,2,1,4
R$ 2.865 /mês,R$ 100,"Rua Sinimbu, São Cristóvão",200 m²,5,0,2
R$ 800 /mês,R$ 50,"Rua Professor Valter Frankel, Irajá",70 m²,1,0,1
R$ 6.500 /mês,R$ 3.294,"Praça Poeta Gibraim, Leblon",192 m²,4,2,4
R$ 2.000 /mês,R$ 424,"Saúde, Rio de Janeiro",65 m²,0,0,2
R$ 3.500 /mês,0,"Rua Candelária, Centro",90 m²,0,0,1
R$ 2.000 /mês,R$ 731,"Rua São Francisco Xavier, Maracanã",76 m²,2,0,1
R$ 1.190 /mês,0,"Rua Orcadas, Jardim Carioca",50 m²,1,0,1
R$ 1.350 /mês,R$ 748,"Rua Barão de Itaipu, Andaraí",78 m²,2,0,2
R$ 1.800 /mês,R$ 508,"Rua Santos Lima, São Cristóvão",149 m²,0,0,1
R$ 600 /mês,R$ 543,"Avenida Presidente Vargas, Centro",21 m²,0,0,1
R$ 3.000 /mês,R$ 320,"Rua Monte Alegre, Centro",75 m²,2,0,1
R$ 1.100 /mês,R$ 450,"Rua do Catete, Catete",28 m²,1,0,1
R$ 250 /mês,R$ 159,"Centro, Rio de Janeiro",17 m²,0,0,1
R$ 3.000 /mês,R$ 560,"Rua Washington Luiz, Centro",50 m²,2,0,1
R$ 5.910 /mês,R$ 385,"Rua Monsenhor Marques, Pechincha",400 m²,5,5,6
R$ 3.700 /mês,R$ 950,"Rua Anchieta, Leme",103 m²,2,0,2
R$ 850 /mês,R$ 770,"Avenida Nossa Senhora de Copacabana, Copacabana",40 m²,0,0,1
R$ 1.850 /mês,R$ 352,"Rua Gustavo Sampaio, Leme",30 m²,1,0,1
R$ 750 /mês,R$ 410,"Rua Haddock Lobo, Tijuca",23 m²,0,1,1
R$ 1.700 /mês,R$ 600,"Avenida Nossa Senhora de Copacabana, Copacabana",45 m²,1,0,1
R$ 1.108 /mês,R$ 329,"Rua Santo Amaro, Santa Teresa",25 m²,1,0,1
R$ 1.750 /mês,R$ 503,"Rua do Catete, Catete",36 m²,1,0,1
R$ 1.000 /mês,R$ 190,"Irajá, Rio de Janeiro",42 m²,1,0,1
R$ 2.900 /mês,R$ 575,"Centro, Rio de Janeiro",135 m²,0,0,4
R$ 637 /mês,0,"Rua Gentil de Ouro, Campo Grande",51 m²,2,0,1
R$ 2.100 /mês,R$ 878,"Avenida Princesa Isabel, Copacabana",75 m²,2,0,1
R$ 800 /mês,R$ 1,"Rua da Assembléia, Centro",22 m²,0,1,0
R$ 840 /mês,R$ 50,"Rua Ministro Gabriel de Piza, Pechincha",50 m²,2,0,1
R$ 1.100 /mês,R$ 285,"Rua do Catete, Catete",25 m²,1,0,1
R$ 1.195 /mês,R$ 360,"Rua Vinte de Abril, Centro",24 m²,1,0,1
R$ 870 /mês,R$ 240,"Rua Lígia, Olaria",39 m²,2,0,1
R$ 600 /mês,R$ 641,"Rua Hermengarda, Méier",26 m²,1,0,1
R$ 1.400 /mês,R$ 450,"Rua Voluntários da Pátria, Botafogo",30 m²,1,0,1
R$ 900 /mês,0,"Rua Bernardo Guimarães, Quintino Bocaiúva",50 m²,1,0,1
R$ 990 /mês,R$ 1,"Avenida Dom Hélder Câmara, Pilares",80 m²,1,0,1
R$ 1.300 /mês,R$ 400,"Rio Comprido, Rio de Janeiro",113 m²,2,0,1
R$ 750 /mês,R$ 800,"Rua São Francisco Xavier, Tijuca",30 m²,0,0,0
R$ 1.200 /mês,R$ 800,"Avenida Rio Branco, Centro",32 m²,0,0,1
R$ 1.200 /mês,R$ 490,"Rua General Espírito Santo Cardoso, Tijuca",35 m²,1,0,1
R$ 6.000 /mês,R$ 4.294,"Avenida Rio Branco, Centro",200 m²,0,0,3
R$ 1.000 /mês,R$ 820,"Rua Santo Afonso, Tijuca",37 m²,0,1,0
R$ 1.400 /mês,R$ 579,"Rua Barata Ribeiro, Copacabana",25 m²,0,0,1
R$ 1.200 /mês,R$ 1.199,"Rua da Assembléia, Centro",42 m²,0,0,1
R$ 2.310 /mês,R$ 557,"Rua Gustavo Sampaio, Leme",35 m²,1,0,1
R$ 3.600 /mês,R$ 1.800,"Rua Santa Clara, Copacabana",70 m²,2,1,2
R$ 400 /mês,R$ 520,"Rua Sacadura Cabral, Centro",29 m²,0,0,1
R$ 3.800 /mês,R$ 1.900,"Rua Dias Ferreira, Leblon",36 m²,0,0,1
R$ 769 /mês,0,"Rua Henrique Ferreira, Cascadura",70 m²,1,0,1
R$ 1.500 /mês,R$ 1.980,"Avenida das Américas, Barra da Tijuca",47 m²,0,1,0
R$ 650 /mês,0,"Rua Oito, Campo Grande",50 m²,1,0,1
R$ 3.000 /mês,R$ 1.600,"Barra da Tijuca, Rio de Janeiro",75 m²,0,2,1
R$ 4.950 /mês,R$ 1.471,"Estrada do Bananal, Freguesia- Jacarepaguá",211 m²,4,0,3
R$ 2.500 /mês,0,"Rua do Ouvidor, Centro",57 m²,1,0,2
R$ 3.700 /mês,R$ 782,"Avenida das Américas, Barra da Tijuca",54 m²,0,1,1
R$ 30.000 /mês,R$ 18.700,"Avenida Rodrigues Alves, Centro",1500 m²,0,0,15
R$ 1.000 /mês,0,"Caminho do Veloso, Campo Grande",50 m²,2,0,1
R$ 1.000 /mês,R$ 470,"Rua Marquês de Pombal, Centro",40 m²,1,0,1
R$ 700 /mês,R$ 746,"Avenida Nossa Senhora de Copacabana, Copacabana",27 m²,0,0,1
R$ 1.150 /mês,0,"Rua Bolívia, Cachambi",43 m²,1,0,1
R$ 1.200 /mês,R$ 1.265,"Rua Victor Civita, Barra da Tijuca",45 m²,0,1,2
R$ 1.550 /mês,R$ 507,"Rua Aristides Lobo, Rio Comprido",77 m²,3,0,1
R$ 800 /mês,R$ 466,"Rua Ubaldino do Amaral, Centro",25 m²,1,0,1
R$ 800 /mês,R$ 844,"Avenida Treze de Maio, Centro",32 m²,0,0,1
R$ 1.350 /mês,R$ 1.100,"Rua Almirante Cochrane, Tijuca",80 m²,3,0,3
R$ 3.131 /mês,R$ 1.440,"Barra da Tijuca, Rio de Janeiro",52 m²,0,0,0
R$ 45.000 /mês,0,"Rua Pinto de Figueiredo, Tijuca",978 m²,0,0,10
R$ 2.500 /mês,R$ 1.208,"Rua Conde de Bonfim, Tijuca",56 m²,0,0,1
R$ 1.800 /mês,R$ 70,"Rua Visconde de Itamarati, Maracanã",51 m²,2,0,1
R$ 1.400 /mês,R$ 1.290,"Avenida das Américas, Barra da Tijuca",36 m²,0,1,1
R$ 6.976 /mês,R$ 4.800,"Avenida Pepe, Jardim Oceanico",345 m²,4,4,6
R$ 1.500 /mês,R$ 930,"Rua Pedro Lessa, Centro",80 m²,0,0,2
R$ 6.500 /mês,R$ 3.300,"Rua da Assembléia, Centro",234 m²,0,0,3
R$ 2.000 /mês,R$ 1.100,"Rua Antônio Basílio, Tijuca",120 m²,3,1,1
R$ 1.650 /mês,R$ 1.259,"Rua Jardim Botânico, Jardim Botânico",35 m²,0,0,1
R$ 1.200 /mês,R$ 629,"Rua Dias da Cruz, Méier",23 m²,0,0,1
R$ 500 /mês,R$ 780,"Rua Conde de Bonfim, Tijuca",25 m²,0,0,1
R$ 2.600 /mês,R$ 500,"Rua Roberval Cordeiro de Farias, Recreio Dos Bandeirantes",52 m²,1,0,0
R$ 4.000 /mês,R$ 350,"Rua Haddock Lobo, Rio Comprido",100 m²,0,0,1
R$ 1.190 /mês,R$ 10,"Rua Santa Rita de Cássia, Marechal Hermes",50 m²,1,0,1
R$ 4.200 /mês,R$ 1.060,"Rua Rainha Guilhermina, Leblon",96 m²,2,1,1
R$ 780 /mês,R$ 1.200,"Rua Torres Homem, Vila Isabel",66 m²,2,1,1
R$ 1.200 /mês,R$ 1.193,"Rua Sete de Setembro, Centro",60 m²,0,0,1
R$ 1.500 /mês,R$ 1.050,"Rua Gildásio Amado, Barra da Tijuca",30 m²,0,1,1
R$ 6.500 /mês,R$ 208,"Rua Lopo Saraiva, Tanque",120 m²,0,0,1
R$ 1.200 /mês,R$ 773,"Avenida Olegário Maciel, Barra da Tijuca",27 m²,0,1,1
R$ 650 /mês,R$ 150,"Rua Pacheco Júnior, Brás de Pina",35 m²,1,0,1
R$ 8.160 /mês,R$ 1,"Rua Estevão Silva, Cachambi",477 m²,4,5,7
R$ 1.530 /mês,0,"Rua São Cláudio, Estacio",30 m²,1,0,1
R$ 1.600 /mês,R$ 1.094,"Estrada do Rio Grande, Taquara",44 m²,0,2,2
R$ 850 /mês,R$ 150,"Rua Sergipe, Maracanã",20 m²,1,3,1
R$ 1.150 /mês,R$ 900,"Avenida das Américas, Barra da Tijuca",38 m²,0,1,1
R$ 1.500 /mês,R$ 900,"Avenida Almirante Barroso, Centro",55 m²,0,0,2
R$ 7.000 /mês,R$ 500,"Vigário Geral, Rio de Janeiro",600 m²,0,0,3
R$ 3.600 /mês,R$ 2.315,"Rua Clarice Índio do Brasil, Botafogo",101 m²,3,1,1
R$ 550 /mês,R$ 680,"Rua da Lapa, Centro",30 m²,0,0,1
R$ 280 /mês,R$ 300,"Avenida Presidente Vargas, Centro",15 m²,0,0,0
R$ 3.800 /mês,R$ 1.700,"Rua Francisco Otaviano, Copacabana",50 m²,1,1,1
R$ 6.500 /mês,R$ 3.377,"Rua Buenos Aires, Centro",350 m²,0,0,7
R$ 2.300 /mês,R$ 300,"Largo Frei Cassiano Vilarosa, Tijuca",110 m²,3,0,2
R$ 4.500 /mês,R$ 4.840,"Rua da Alfândega, Centro",250 m²,0,0,3
R$ 5.430 /mês,R$ 1.000,"Rua Sambaíba, Leblon",110 m²,3,1,2
R$ 2.666 /mês,0,"Rua Santa Luzia, Centro",220 m²,0,0,4
R$ 700 /mês,R$ 150,"Avenida João Ribeiro, Pilares",40 m²,1,0,1
R$ 1.600 /mês,R$ 893,"Avenida das Américas, Barra da Tijuca",42 m²,0,1,1
R$ 850 /mês,R$ 665,"Avenida Rio Branco, Centro",25 m²,0,0,1
R$ 950 /mês,0,"Rua André Rocha, Jacarepaguá",45 m²,1,0,1
R$ 1.700 /mês,R$ 525,"Rua Joana Angélica, Ipanema",25 m²,1,0,1
R$ 4.500 /mês,R$ 5.213,"Avenida Graça Aranha, Centro",438 m²,0,0,3
R$ 4.000 /mês,R$ 1.250,"Avenida das Américas, Barra da Tijuca",100 m²,1,2,1
R$ 3.000 /mês,R$ 800,"Avenida Nossa Senhora de Copacabana, Copacabana",86 m²,3,0,1
R$ 1.850 /mês,R$ 490,"Rua Washington Luiz, Centro",27 m²,1,0,1
R$ 4.840 /mês,R$ 1.500,"Rua São Clemente, Botafogo",73 m²,2,1,2
R$ 1.200 /mês,R$ 200,"Campo Grande, Rio de Janeiro",70 m²,2,0,1
R$ 550 /mês,R$ 30,"Estrada dos Bandeirantes, Curicica",35 m²,1,0,1
R$ 1.200 /mês,R$ 488,"Rua Conde de Bonfim, Tijuca",25 m²,0,0,1
R$ 10.000 /mês,R$ 947,"Avenida Rio Branco, Centro",90 m²,0,0,0
R$ 2.000 /mês,R$ 1.180,"Rua Senador Dantas, Centro",60 m²,2,0,1
R$ 7.000 /mês,R$ 770,"Avenida Glaucio Gil, Recreio Dos Bandeirantes",140 m²,1,1,0
R$ 200 /mês,R$ 995,"Rua do Ouvidor, Centro",37 m²,0,0,1
R$ 1.181 /mês,R$ 600,"Boulevard Vinte e Oito de Setembro, Vila Isabel",70 m²,3,0,1
R$ 950 /mês,0,"Rua Araújo Leitão, Engenho Novo",65 m²,1,0,1
R$ 1.200 /mês,R$ 700,"Rua Barão de Mesquita, Andaraí",50 m²,0,0,0
R$ 2.900 /mês,R$ 1.300,"Rua Álvaro Alvim, Centro",50 m²,2,0,2
R$ 2.250 /mês,0,"Rua Álvaro Alvim, Centro",25 m²,1,0,1
R$ 1.000 /mês,R$ 616,"Rua Roberval Cordeiro de Farias, Recreio Dos Bandeirantes",25 m²,0,0,1
R$ 900 /mês,R$ 470,"Rua Felipe de Oliveira, Copacabana",30 m²,1,0,1
R$ 1.900 /mês,R$ 1.365,"Rua Benjamim Franklin, Tijuca",100 m²,3,1,1
R$ 250 /mês,R$ 500,"Rua Uruguaiana, Centro",38 m²,0,0,1
R$ 6.500 /mês,R$ 55,"Rua Flavia Farnese, Bonsucesso",270 m²,0,0,1
R$ 1.000 /mês,R$ 1.370,"Rua Camerino, Centro",108 m²,1,0,1
R$ 4.000 /mês,R$ 526,"Taquara, Rio de Janeiro",75 m²,0,1,1
R$ 75.000 /mês,0,"Estrada do Cortume, Santa Cruz",4000 m²,0,0,0
R$ 3.500 /mês,R$ 1.257,"Rua Jardim Botânico, Jardim Botânico",109 m²,2,0,3
R$ 2.000 /mês,R$ 768,"Rua da Quitanda, Centro",49 m²,0,0,1
R$ 4.000 /mês,R$ 1.177,"Avenida Maracanã, Tijuca",227 m²,0,0,2
R$ 200 /mês,0,"Avenida Princesa Isabel, Copacabana",4 m²,0,0,0
R$ 480 /mês,R$ 600,"Centro, Rio de Janeiro",56 m²,0,0,1
R$ 6.000 /mês,R$ 1.443,"Estrada Sorima, Barra da Tijuca",96 m²,0,0,2
R$ 4.455 /mês,0,"Rua Sousa Valente, São Cristóvão",162 m²,1,0,1
R$ 1.500 /mês,R$ 450,"Rua Curuzu, São Cristóvão",100 m²,3,0,1
R$ 500 /mês,R$ 322,"Avenida Presidente Vargas, Centro",24 m²,0,0,1
R$ 1.300 /mês,R$ 983,"Avenida Churchill, Centro",38 m²,0,0,2
R$ 7.500 /mês,R$ 5.960,"Avenida Rio Branco, Centro",375 m²,0,0,4
R$ 1.200 /mês,R$ 690,"Avenida Nossa Senhora de Copacabana, Copacabana",43 m²,0,0,1
R$ 10.000 /mês,R$ 5.690,"Rua da Assembléia, Centro",191 m²,0,0,2
R$ 900 /mês,R$ 84,"Pilares, Rio de Janeiro",66 m²,2,0,1
R$ 5.500 /mês,R$ 1.215,"Rua Santa América, Vargem Grande",2895 m²,0,0,0
R$ 5.500 /mês,R$ 104,"Avenida Canal das Taxas, Recreio Dos Bandeirantes",592 m²,0,0,0
R$ 880 /mês,R$ 50,"Rua Esmeraldino Bandeira, Engenho Novo",50 m²,1,0,1
R$ 990 /mês,R$ 325,"Rua Cândido Mendes, Glória",26 m²,1,0,1
R$ 800 /mês,R$ 20,"Rua A, Bento Ribeiro",49 m²,1,0,1
R$ 3.200 /mês,R$ 1.040,"Avenida das Américas, Recreio Dos Bandeirantes",75 m²,0,1,1
R$ 1.400 /mês,R$ 750,"Centro, Rio de Janeiro",40 m²,0,0,1
R$ 1.500 /mês,R$ 1.000,"Rua Gomes Carneiro, Ipanema",31 m²,0,0,1
R$ 2.910 /mês,R$ 1.000,"Avenida Salvador Allende, Recreio Dos Bandeirantes",80 m²,3,0,2
R$ 2.500 /mês,R$ 1.370,"Avenida das Américas, Barra da Tijuca",34 m²,0,1,0
R$ 1.800 /mês,R$ 499,"Campo Grande, Rio de Janeiro",53 m²,0,1,1
R$ 1.105 /mês,0,"Rua Guatambu, Marechal Hermes",80 m²,1,0,1
R$ 500 /mês,R$ 430,"Rua Evaristo da Veiga, Centro",34 m²,1,0,1
R$ 1.200 /mês,R$ 600,"Rua Domingos Ferreira, Copacabana",29 m²,1,0,1
R$ 800 /mês,R$ 1.300,"Rua Araújo Porto Alegre, Centro",50 m²,0,0,1
R$ 2.100 /mês,R$ 1.043,"Avenida Flamboyants da Península, Barra da Tijuca",42 m²,0,1,0
R$ 6.500 /mês,R$ 2.200,"Rua Gomes Carneiro, Ipanema",180 m²,3,0,2
R$ 1.500 /mês,R$ 935,"Avenida Churchill, Centro",110 m²,0,0,1
R$ 1.600 /mês,R$ 748,"Rua Marquês de Valença, Tijuca",87 m²,3,1,3
R$ 500 /mês,R$ 600,"Estrada Pau-ferro, Pechincha",25 m²,0,0,0
R$ 2.500 /mês,R$ 1.200,"Avenida Nossa Senhora de Copacabana, Copacabana",75 m²,2,0,1
R$ 2.700 /mês,R$ 550,"Rua Santo Amaro, Glória",85 m²,3,0,2
R$ 1.400 /mês,R$ 1.181,"Estrada da Gávea, São Conrado",50 m²,0,1,1
R$ 2.500 /mês,R$ 960,"Avenida Franklin Roosevelt, Centro",94 m²,0,0,1
R$ 2.000 /mês,R$ 245,"Praça da Bandeira, Tijuca",20 m²,1,0,1
R$ 2.700 /mês,R$ 745,"Avenida Franklin Roosevelt, Centro",89 m²,0,0,1
R$ 8.000 /mês,R$ 4.500,"Rua do Carmo, Centro",350 m²,0,0,3
R$ 900 /mês,R$ 1.250,"Avenida Ayrton Senna, Barra da Tijuca",33 m²,0,1,1
R$ 1.350 /mês,R$ 585,"Copacabana, Rio de Janeiro",35 m²,1,0,1
R$ 1.000 /mês,0,"Rua Conde de Linhares, Oswaldo Cruz",47 m²,1,0,1
R$ 600 /mês,0,"Rua Almirante Melquíades de Souza, Tanque",43 m²,1,0,1
R$ 900 /mês,R$ 810,"Rua Haddock Lobo, Estacio",30 m²,0,1,1
R$ 999 /mês,R$ 810,"Centro, Rio de Janeiro",60 m²,0,0,3
R$ 550 /mês,0,"Rua Navarro, Santa Teresa",35 m²,0,0,1
R$ 800 /mês,R$ 410,"Rua Taylor, Santa Teresa",28 m²,1,0,1
R$ 650 /mês,R$ 130,"Rua Doutor Antônio Leal, Honório Gurgel",35 m²,1,0,1
R$ 3.500 /mês,R$ 450,"Rua Conde de Bonfim, Tijuca",45 m²,0,0,1
R$ 4.500 /mês,R$ 1.480,"Alameda A, Recreio Dos Bandeirantes",189 m²,4,2,5
R$ 960 /mês,R$ 29,"Rua Angelina, Piedade",50 m²,1,0,1
R$ 600 /mês,R$ 330,"Rua Campo, São Cristóvão",28 m²,1,0,1
R$ 600 /mês,R$ 344,"Rua Benedito Ottoni, São Cristóvão",32 m²,1,0,1
R$ 1.136 /mês,R$ 120,"Estrada Benvindo de Novaes, Recreio Dos Bandeirantes",26 m²,1,0,1
R$ 4.360 /mês,R$ 1.200,"Avenida Nossa Senhora de Copacabana, Copacabana",107 m²,3,3,2
R$ 1.100 /mês,R$ 490,"Rua Frei Caneca, Centro",30 m²,1,0,1
R$ 1.300 /mês,R$ 649,"Rua Conde de Bonfim, Tijuca",28 m²,0,1,1
R$ 1.300 /mês,R$ 480,"Avenida Nossa Senhora de Copacabana, Copacabana",27 m²,1,0,1
R$ 2.900 /mês,R$ 837,"Barra da Tijuca, Rio de Janeiro",68 m²,0,1,0
R$ 850 /mês,0,"Rua Teixeira de Pinho, Piedade",50 m²,1,0,1
R$ 1.100 /mês,R$ 797,"Rua Roberval Cordeiro de Farias, Recreio Dos Bandeirantes",32 m²,0,0,0
R$ 5.000 /mês,R$ 616,"Rua Coronel João Olintho, Recreio Dos Bandeirantes",70 m²,0,1,0
R$ 880 /mês,0,"Rua Marques de Oliveira, Ramos",50 m²,1,0,1
R$ 650 /mês,0,"Rua Júlio Sousa, Campo Grande",25 m²,1,0,1
R$ 950 /mês,R$ 800,"Estrada do Portela, Madureira",33 m²,0,1,1
R$ 5.700 /mês,R$ 400,"Rua Professor Santos Moreira, Vargem Pequena",350 m²,4,3,6
R$ 1.300 /mês,R$ 675,"Barra da Tijuca, Rio de Janeiro",29 m²,0,1,0
R$ 2.600 /mês,R$ 788,"Rua Jardim Botânico, Jardim Botânico",135 m²,4,0,2
R$ 1.800 /mês,0,"Praia Botafogo, Botafogo",21 m²,1,0,1
R$ 2.201 /mês,R$ 250,"Rua Justiniano da Rocha, Vila Isabel",150 m²,3,0,1
R$ 10.800 /mês,R$ 1.367,"Rua da Alfândega, Centro",216 m²,0,0,3
R$ 950 /mês,R$ 740,"Barra da Tijuca, Rio de Janeiro",21 m²,1,1,0
R$ 850 /mês,R$ 150,"Rua Álvaro Ramos, Botafogo",26 m²,1,0,1
R$ 1.550 /mês,R$ 500,"Avenida Maracanã, Tijuca",45 m²,1,0,1
R$ 714 /mês,0,"Rua Uranos, Olaria",60 m²,1,0,1
R$ 2.850 /mês,R$ 1.420,"Rua das Laranjeiras, Laranjeiras",112 m²,3,3,2
R$ 1.500 /mês,R$ 500,"Praça Vereador Rocha Leão, Copacabana",37 m²,1,0,1
R$ 5.000 /mês,R$ 250,"Avenida Geremário Dantas, Pechincha",125 m²,0,2,1
R$ 3.500 /mês,R$ 2.125,"Rua da Assembléia, Centro",90 m²,0,0,1
R$ 3.000 /mês,R$ 1.361,"Avenida das Américas, Barra da Tijuca",42 m²,0,2,1
R$ 765 /mês,R$ 381,"Rua A, Campo Grande",55 m²,1,0,1
R$ 700 /mês,R$ 538,"Rua Sacadura Cabral, Saúde",30 m²,0,0,1
R$ 800 /mês,R$ 750,"Jacarepaguá, Rio de Janeiro",24 m²,0,1,1
R$ 1.200 /mês,R$ 30,"Rua Venceslau, Méier",50 m²,2,0,1
R$ 900 /mês,0,"Rua Abatira, Engenho Novo",50 m²,2,0,1
R$ 5.000 /mês,R$ 8.700,"Avenida Ministro Edgard Romero, Madureira",83 m²,0,0,0
R$ 700 /mês,0,"Rua Professor Gastão Bahiana, Copacabana",28 m²,1,0,1
R$ 3.800 /mês,R$ 1.480,"Rua Deodato de Morais, Barra da Tijuca",94 m²,3,2,2
R$ 8.000 /mês,R$ 7.200,"Centro, Rio de Janeiro",292 m²,0,0,3
R$ 2.000 /mês,R$ 1.345,"Rua do Ouvidor, Centro",48 m²,0,0,0
R$ 1.200 /mês,R$ 940,"Avenida Ayrton Senna, Barra da Tijuca",35 m²,0,1,1
R$ 1.105 /mês,0,"Estrada Capenha, Freguesia",25 m²,2,0,1
R$ 1.400 /mês,R$ 920,"Rua Comendador Siqueira, Pechincha",120 m²,4,2,2
R$ 1.200 /mês,0,"Avenida Lusitania, Penha",105 m²,1,0,1
R$ 6.000 /mês,R$ 766,"Rua Senador Dantas, Centro",81 m²,0,0,1
R$ 2.200 /mês,R$ 1.100,"Rua das Laranjeiras, Laranjeiras",50 m²,2,0,1
R$ 1.300 /mês,0,"Rua Severiano Monteiro, Vista Alegre",60 m²,2,0,1
R$ 1.500 /mês,R$ 952,"Avenida Rio Branco, Centro",47 m²,0,0,1
R$ 4.000 /mês,R$ 2.167,"Rua Sorocaba, Botafogo",95 m²,3,2,3
R$ 650 /mês,R$ 765,"Méier, Rio de Janeiro",30 m²,1,0,1
R$ 800 /mês,0,"Rua General Cláudio, Marechal Hermes",70 m²,1,0,1
R$ 1.800 /mês,0,"Taquara, Rio de Janeiro",60 m²,0,0,1
R$ 950 /mês,R$ 560,"Copacabana, Rio de Janeiro",29 m²,0,0,1
R$ 1.000 /mês,R$ 579,"Rua Roberval Cordeiro de Farias, Recreio Dos Bandeirantes",21 m²,0,0,0
R$ 3.500 /mês,R$ 500,"Rua Antônio Parreiras, Ipanema",43 m²,1,0,1
R$ 900 /mês,R$ 241,"Travessa do Paço, Centro",34 m²,0,0,1
R$ 3.000 /mês,R$ 1.100,"Avenida das Américas, Barra da Tijuca",70 m²,0,1,0
R$ 600 /mês,R$ 400,"Rua Senador Dantas, Centro",30 m²,1,0,1
R$ 3.590 /mês,R$ 389,"Rua Silva Rabelo, Engenho De Dentro",70 m²,0,0,1
R$ 1.600 /mês,R$ 2.558,"Andaraí, Rio de Janeiro",45 m²,0,0,0
R$ 2.500 /mês,R$ 1.400,"Avenida Cláudio Besserman Vianna, Barra da Tijuca",114 m²,4,2,4
R$ 15.000 /mês,R$ 1.850,"Avenida Senador Danton Jobim, Barra da Tijuca",370 m²,4,4,6
R$ 4.500 /mês,R$ 1.707,"Rua Sorocaba, Botafogo",94 m²,3,1,2
R$ 3.000 /mês,R$ 1.385,"Barra da Tijuca, Rio de Janeiro",53 m²,0,1,1
R$ 3.000 /mês,R$ 2.003,"Rua Sete de Setembro, Centro",107 m²,0,0,2
R$ 1.500 /mês,R$ 330,"Rua Constança Barbosa, Méier",91 m²,2,0,1
R$ 2.200 /mês,R$ 800,"Centro, Rio de Janeiro",42 m²,0,0,1
R$ 1.300 /mês,R$ 588,"Rua do Fialho, Glória",26 m²,1,0,1
R$ 650 /mês,R$ 270,"Rua Dias da Cruz, Méier",30 m²,0,0,0
R$ 850 /mês,R$ 770,"Avenida Nossa Senhora de Copacabana, Copacabana",39 m²,0,0,1
R$ 700 /mês,R$ 450,"Avenida Nossa Senhora de Copacabana, Copacabana",22 m²,0,0,0
R$ 4.500 /mês,R$ 800,"Rua Sá Ferreira, Copacabana",55 m²,2,0,2
R$ 1.010 /mês,R$ 32,"Rua Angelina, Piedade",55 m²,1,0,1
R$ 2.010 /mês,R$ 300,"Largo Frei Cassiano Vilarosa, Tijuca",110 m²,3,0,1
R$ 1.400 /mês,R$ 700,"Praça Mahatma Gandhi, Centro",33 m²,0,0,1
R$ 4.000 /mês,0,"Rua Floriano de Lemos, Irajá",150 m²,2,1,1
R$ 4.000 /mês,R$ 1.600,"Avenida das Américas, Barra da Tijuca",80 m²,1,1,1
R$ 3.000 /mês,R$ 1.400,"Alameda A, Recreio Dos Bandeirantes",154 m²,3,2,2
R$ 3.000 /mês,R$ 600,"Rua das Laranjeiras, Laranjeiras",66 m²,3,0,1
R$ 3.300 /mês,R$ 1.400,"Rua do Humaitá, Humaitá",70 m²,2,1,1
R$ 700 /mês,R$ 900,"Barra da Tijuca, Rio de Janeiro",30 m²,0,1,1
R$ 600 /mês,R$ 465,"Rua do Resende, Centro",27 m²,1,0,1
R$ 3.000 /mês,R$ 980,"Avenida Geremário Dantas, Freguesia",160 m²,4,1,3
R$ 800 /mês,R$ 470,"Rua de Santana, Centro",40 m²,1,0,1
R$ 6.000 /mês,R$ 179,"Rua Livio Barreto, Taquara",378 m²,4,8,4
R$ 700 /mês,R$ 833,"Rua Barão de São Francisco, Vila Isabel",30 m²,0,1,1
R$ 5.000 /mês,R$ 1.188,"Avenida Lineu de Paula Machado, Lagoa",89 m²,3,1,3
R$ 2.990 /mês,R$ 1.700,"Rua Voluntários da Pátria, Botafogo",50 m²,0,2,1
R$ 2.500 /mês,R$ 700,"Rua Siqueira Campos, Copacabana",42 m²,1,0,1
R$ 1.400 /mês,R$ 970,"Avenida das Américas, Barra da Tijuca",38 m²,0,1,1
R$ 900 /mês,R$ 1.346,"Avenida Nossa Senhora de Copacabana, Copacabana",31 m²,0,0,0
R$ 1.600 /mês,R$ 254,"Barra da Tijuca, Rio de Janeiro",35 m²,0,1,1
R$ 2.300 /mês,R$ 733,"Rua General Ribeiro da Costa, Leme",38 m²,1,0,1
R$ 2.600 /mês,R$ 1.000,"Avenida Nossa Senhora de Copacabana, Copacabana",105 m²,3,0,1
R$ 1.000 /mês,R$ 847,"Avenida das Américas, Barra da Tijuca",55 m²,0,1,1
R$ 1.900 /mês,R$ 550,"Rua Correa Dutra, Flamengo",38 m²,1,0,1
R$ 10.000 /mês,R$ 5.912,"Jardim América, Rio de Janeiro",2100 m²,0,10,4
R$ 800 /mês,R$ 440,"Rua Senador Nabuco, Vila Isabel",35 m²,1,0,1
R$ 1.250 /mês,R$ 80,"Rua Mariz e Barros, Maracanã",22 m²,1,0,1
R$ 1.800 /mês,R$ 1.291,"Centro, Rio de Janeiro",100 m²,0,2,2
R$ 3.500 /mês,R$ 1.515,"Rua Voluntários da Pátria, Botafogo",43 m²,0,1,1
R$ 5.600 /mês,R$ 2.220,"Rua A, Gávea",170 m²,4,3,4
R$ 950 /mês,0,"Rua das Oficinas, Engenho Da Rainha",45 m²,1,0,1
R$ 200 /mês,0,"Avenida Princesa Isabel, Copacabana",5 m²,0,0,0
R$ 600 /mês,R$ 1.250,"Avenida Ayrton Senna, Barra da Tijuca",32 m²,0,1,1
R$ 1.800 /mês,R$ 697,"Rua Conde de Bonfim, Tijuca",35 m²,0,1,1
R$ 2.200 /mês,R$ 900,"Avenida Princesa Isabel, Copacabana",75 m²,2,0,1
R$ 4.900 /mês,R$ 1.200,"Avenida Gilka Machado, Recreio Dos Bandeirantes",206 m²,2,2,2
R$ 700 /mês,R$ 717,"Rua Sete de Setembro, Centro",31 m²,1,0,1
R$ 150 /mês,R$ 220,"Rua Barão de Mesquita, Tijuca",15 m²,0,0,0
R$ 1.850 /mês,R$ 150,"Rua Tonelero, Copacabana",28 m²,1,0,1
R$ 4.950 /mês,R$ 1.450,"Praça Professor José Bernardino, Barra da Tijuca",140 m²,3,2,2
R$ 1.200 /mês,R$ 400,"Rua Grão Pará, Engenho Novo",100 m²,3,0,1
R$ 750 /mês,0,"Rua Frei Damião Berge, Água Santa",32 m²,1,0,2
R$ 6.000 /mês,R$ 1.800,"Rua Gomes Carneiro, Ipanema",220 m²,4,2,3
R$ 750 /mês,0,"Rua São Calisto, Taquara",50 m²,1,0,1
R$ 1.100 /mês,R$ 540,"Barra da Tijuca, Rio de Janeiro",25 m²,0,0,1
R$ 75.000 /mês,R$ 2.737,"Estrada dos Bandeirantes, Vargem Grande",6000 m²,0,0,0
R$ 15.000 /mês,R$ 1.103,"Estrada Vereador Alceu de Carvalho, Recreio Dos Bandeirantes",387 m²,6,2,6
R$ 1.300 /mês,R$ 800,"Avenida Nossa Senhora de Copacabana, Copacabana",40 m²,0,1,0
R$ 800 /mês,R$ 150,"Rua Juriti, Irajá",32 m²,1,0,1
R$ 2.500 /mês,R$ 850,"Rua Tonelero, Copacabana",80 m²,3,0,2
R$ 2.220 /mês,R$ 450,"Rua São Gabriel, Cachambi",100 m²,4,1,3
R$ 741 /mês,R$ 150,"Rua Flávio José da Costa, Pitangueiras",26 m²,1,0,1
R$ 800 /mês,R$ 1.100,"Rua Victor Civita, Barra da Tijuca",34 m²,0,1,1
